{
  "schemaVersion": 2,
  "baseline": {
    "historicalCommit": "c2359f00fc3bac80bfbc2e82369a86f20e522f74",
    "migrationCommit": "6f8383cd6a318e0fe03506bc96401f5161c6e222",
    "membership": {
      "path": "src/assurance/generated/lifecycle-baseline-membership.json",
      "blob": "e2f4aad3146649fdfe2063abc780dc73a99bdd64"
    },
    "lifecycle": "Published",
    "reviewRef": "review-v014-public-assurance"
  },
  "reviewEvents": [
    {
      "id": "review-v014-public-assurance",
      "status": "Reviewed",
      "reviewedAt": "2026-09-03T04:06:18Z",
      "reviewer": "controlled-repository-review",
      "basis": "v0.14.0 release PR #73 and tag-bound public-assurance validation"
    },
    {
      "id": "review-objectives-pr56",
      "status": "Reviewed",
      "reviewedAt": "2026-09-02T22:37:55Z",
      "reviewer": "Controlled pull request and merge",
      "basis": "WG-OBJ-001 approval record: PR #56 and merge commit 1ae105da8ab6466e334a2faf4e6c63f5885c91df"
    },
    {
      "id": "review-demo155-current-sources",
      "status": "Reviewed",
      "reviewedAt": "2026-09-04T13:00:00Z",
      "reviewer": "controlled-repository-review",
      "basis": "DEMO-155 migration review binds disclosure approval to the exact registry-driven public source revisions present at commit 6f8383cd6a318e0fe03506bc96401f5161c6e222; later source revisions require a new disclosure decision."
    },
    {
      "id": "review-demo174-relationship-sources",
      "status": "Reviewed",
      "reviewedAt": "2026-09-06T18:53:26Z",
      "reviewer": "controlled-repository-review",
      "basis": "DEMO-174 review approves the exact public source revisions produced by the canonical identity-edge relationship migration; later source revisions require a new disclosure decision."
    },
    {
      "id": "review-demo180-interface-route-source",
      "status": "Reviewed",
      "reviewedAt": "2026-09-07T02:35:00Z",
      "reviewer": "controlled-repository-review",
      "basis": "DEMO-180 review approves superseding the retired accessibility page evidence with a new consolidated Interfaces view record and the exact resulting public evidence source revision; later source revisions require a new disclosure decision."
    },
    {
      "id": "review-demo181-assurance-surface-source",
      "status": "Reviewed",
      "reviewedAt": "2026-09-07T02:45:00Z",
      "reviewer": "controlled-repository-review",
      "basis": "DEMO-181 review approves superseding the retired public concern route evidence with a new consolidated Assurance concerns-view record, migrating current relationship edges to that evidence identity, and the exact resulting public source revisions; later source revisions require a new disclosure decision."
    },
    {
      "id": "review-demo184-canonical-api-routes",
      "status": "Reviewed",
      "reviewedAt": "2026-09-07T17:32:39Z",
      "reviewer": "controlled-repository-review",
      "basis": "DEMO-184 review approves superseding the retired health and version route evidence with canonical operations API records, migrating current relationship edges to the replacement identities, and the exact resulting public source revisions; later source revisions require a new disclosure decision."
    },
    {
      "id": "review-demo187-route-collapse-audit",
      "status": "Reviewed",
      "reviewedAt": "2026-09-07T20:45:01Z",
      "reviewer": "controlled-repository-review",
      "basis": "DEMO-187 final route-collapse review approves the objectives source revision that replaces its removed version pathname with the canonical operations API endpoint; later source revisions require a new disclosure decision."
    },
    {
      "id": "review-demo195-assurance-child-routes",
      "status": "Reviewed",
      "reviewedAt": "2026-09-08T12:05:37Z",
      "reviewer": "controlled-repository-review",
      "basis": "DEMO-195 review approves superseding the retired assurance concern query-view evidence with a canonical assurance child-route record, migrating current relationship edges to the replacement identity, and the exact resulting public source revisions; later source revisions require a new disclosure decision."
    },
    {
      "id": "review-demo238-accessibility-assurance",
      "status": "Reviewed",
      "reviewedAt": "2026-09-09T23:30:00Z",
      "reviewer": "controlled-repository-review",
      "basis": "DEMO-238 review approves publication of the bounded site-wide accessibility and localization automation evidence and the explicitly pending manual verification matrix, together with the exact resulting public evidence and WCAG framework source revisions. This disclosure review does not record manual accessibility execution or establish WCAG conformance."
    },
    {
      "id": "review-demo242-consolidated-demos",
      "status": "Reviewed",
      "reviewedAt": "2026-09-10T14:45:00Z",
      "reviewer": "controlled-repository-review",
      "basis": "DEMO-242 review approves EVD-RUN-012 as the successor to the retired EVD-RUN-007 accessibility query-view locator, using the canonical Demos fragment. No evidence claim, observation, or disclosure scope is widened."
    },
    {
      "id": "review-demo244-consolidated-assurance",
      "status": "Reviewed",
      "reviewedAt": "2026-09-10T17:35:16Z",
      "reviewer": "controlled-repository-review",
      "basis": "DEMO-244 review approves EVD-RUN-013 as the successor to the retired EVD-RUN-011 concern-intake child-route locator, migrates current relationship edges to the replacement identity, and approves the exact resulting public runtime source revisions. The public concern scope and disclosure boundary are unchanged."
    },
    {
      "id": "review-demo258-minimal-assurance",
      "status": "Reviewed",
      "reviewedAt": "2026-09-15T04:36:50Z",
      "reviewer": "controlled-repository-review",
      "basis": "DEMO-258 review approves EVD-RUN-014 as the successor to EVD-RUN-013, moves the concern-intake locator from the removed Assurance inventory to the contextual non-security feedback handoff on Security, migrates active relationship edges, and approves the exact resulting public runtime source revisions. The public issue-form scope and disclosure boundary are unchanged."
    },
    {
      "id": "review-demo285-assessment-documentation-contract",
      "status": "Reviewed",
      "reviewedAt": "2026-09-17T00:52:17Z",
      "reviewer": "controlled-repository-review",
      "basis": "DEMO-285 review approves the mechanical compliance-status vocabulary migration and the exact resulting public compliance source revisions. No compliance record is reassessed, no evidence relationship changes, and documentation references remain unpopulated until DEMO-287 through DEMO-289."
    },
    {
      "id": "review-demo287-iso27001-reassessment",
      "status": "Reviewed",
      "reviewedAt": "2026-09-17T10:00:00Z",
      "reviewer": "controlled-repository-self-assessment",
      "basis": "DEMO-287 owner/operator Self-Assessment reassesses all ISO/IEC 27001:2022 clause and Annex A records under the current rubric, includes ISO/IEC 27001:2022/Amd 1:2024 climate considerations, preserves all evidence relationships, and approves disclosure of the exact resulting public compliance source revision. This is not an internal audit or certification claim."
    },
    {
      "id": "review-demo288-iso42001-reassessment",
      "status": "Reviewed",
      "reviewedAt": "2026-09-17T10:53:48Z",
      "reviewer": "controlled-repository-self-assessment",
      "basis": "DEMO-288 owner/operator Self-Assessment reassesses all ISO/IEC 42001:2023 clause and Annex A records under the current rubric, records the DEMO-284 MCP boundary tests in the governed security-testing register, preserves all evidence relationships, and approves disclosure of the exact resulting public compliance source revision. This is not an internal audit or certification claim."
    },
    {
      "id": "review-demo289-wcag-evaluation",
      "status": "Reviewed",
      "reviewedAt": "2026-09-17T12:00:00Z",
      "reviewer": "controlled-repository-accessibility-evaluation",
      "basis": "DEMO-289 evaluates all 86 WCAG 2.2 A/AA/AAA criteria across every canonical public HTML page and configured state in English and Arabic, records only executed manual procedures, preserves every evidence relationship, and makes no WCAG conformance or certification claim."
    },
    {
      "id": "review-demo300-repository-protection",
      "status": "Reviewed",
      "reviewedAt": "2026-09-18T08:22:31Z",
      "reviewer": "controlled-repository-self-assessment",
      "basis": "DEMO-300 performs a focused owner/operator reassessment of ISO/IEC 27001:2022 A.8.25 and A.8.32 after verified GitHub branch, tag, and merge-setting enforcement. It preserves every evidence relationship, keeps both controls Partial pending a later effectiveness review, approves disclosure of the exact resulting public compliance source revision, and makes no internal-audit, certification, or conformance claim."
    },
    {
      "id": "review-demo304-wcag-remediation",
      "status": "Reviewed",
      "reviewedAt": "2026-09-18T14:48:00Z",
      "reviewer": "controlled-repository-accessibility-evaluation",
      "basis": "DEMO-304 performs a focused WCAG 2.2 reassessment of 1.4.10, 2.4.4, and 2.4.9 after the D1 320 CSS-pixel reflow correction and destination-specific repeated-link accessible names. It preserves every evidence relationship, approves disclosure of the exact resulting public WCAG partition source revisions, and makes no WCAG conformance or certification claim."
    },
    {
      "id": "review-demo313-structured-assurance-authority",
      "status": "Reviewed",
      "reviewedAt": "2026-09-18T21:56:00Z",
      "reviewer": "controlled-repository-review",